{
  "$id": "urn:aniukas-lossless-memory:format:1:commit",
  "$schema": "https://json-schema.org/draft/2020-12/schema",
  "additionalProperties": false,
  "if": {
    "properties": {
      "high_impact": {
        "const": true
      }
    }
  },
  "properties": {
    "caused_by": {
      "items": {
        "pattern": "^[A-Za-z][A-Za-z0-9_.:-]{1,127}$",
        "type": "string"
      },
      "minItems": 0,
      "type": "array",
      "uniqueItems": true
    },
    "created_at": {
      "format": "date-time",
      "pattern": "^\\d{4}-\\d{2}-\\d{2}T\\d{2}:\\d{2}:\\d{2}Z$",
      "type": "string"
    },
    "expected_revisions": {
      "items": {
        "additionalProperties": false,
        "properties": {
          "record_id": {
            "pattern": "^[A-Za-z][A-Za-z0-9_.:-]{1,127}$",
            "type": "string"
          },
          "revision_id": {
            "anyOf": [
              {
                "pattern": "^[A-Za-z][A-Za-z0-9_.:-]{1,127}$",
                "type": "string"
              },
              {
                "type": "null"
              }
            ]
          }
        },
        "required": [
          "record_id",
          "revision_id"
        ],
        "type": "object"
      },
      "minItems": 0,
      "type": "array",
      "uniqueItems": true
    },
    "extensions": {
      "propertyNames": {
        "pattern": "^[a-z0-9]+[.][a-z0-9_.-]+$"
      },
      "type": "object"
    },
    "format_version": {
      "const": "1"
    },
    "grant_id": {
      "pattern": "^[A-Za-z][A-Za-z0-9_.:-]{1,127}$",
      "type": "string"
    },
    "high_impact": {
      "type": "boolean"
    },
    "id": {
      "pattern": "^[A-Za-z][A-Za-z0-9_.:-]{1,127}$",
      "type": "string"
    },
    "idempotency_key": {
      "minLength": 1,
      "type": "string"
    },
    "instance_id": {
      "pattern": "^[A-Za-z][A-Za-z0-9_.:-]{1,127}$",
      "type": "string"
    },
    "kind": {
      "const": "commit"
    },
    "payload_sha256": {
      "pattern": "^[a-f0-9]{64}$",
      "type": "string"
    },
    "principal_id": {
      "pattern": "^[A-Za-z][A-Za-z0-9_.:-]{1,127}$",
      "type": "string"
    },
    "review_receipt_ids": {
      "items": {
        "pattern": "^[A-Za-z][A-Za-z0-9_.:-]{1,127}$",
        "type": "string"
      },
      "minItems": 0,
      "type": "array",
      "uniqueItems": true
    },
    "scope_id": {
      "pattern": "^[A-Za-z][A-Za-z0-9_.:-]{1,127}$",
      "type": "string"
    },
    "sequence": {
      "minimum": 1,
      "type": "integer"
    },
    "source_refs": {
      "items": {
        "pattern": "^(mem|rev|win|log|map|proposal|candidate|conflict|commit|review|outbox|audit)://[A-Za-z][A-Za-z0-9_.:-]{1,127}(?:/m[1-9][0-9]*(?:-[1-9][0-9]*)?)?$",
        "type": "string"
      },
      "minItems": 0,
      "type": "array",
      "uniqueItems": true
    },
    "writes": {
      "items": {
        "pattern": "^(mem|rev|win|log|map|proposal|candidate|conflict|commit|review|outbox|audit)://[A-Za-z][A-Za-z0-9_.:-]{1,127}(?:/m[1-9][0-9]*(?:-[1-9][0-9]*)?)?$",
        "type": "string"
      },
      "minItems": 1,
      "type": "array",
      "uniqueItems": true
    }
  },
  "required": [
    "format_version",
    "instance_id",
    "kind",
    "id",
    "scope_id",
    "principal_id",
    "grant_id",
    "sequence",
    "created_at",
    "idempotency_key",
    "payload_sha256",
    "caused_by",
    "writes",
    "expected_revisions",
    "source_refs",
    "high_impact",
    "review_receipt_ids"
  ],
  "then": {
    "properties": {
      "review_receipt_ids": {
        "minItems": 1
      }
    }
  },
  "title": "Aniukas Lossless Memory profile 1: commit",
  "type": "object"
}
