{
  "caused_by": [],
  "created_at": "2026-09-23T12:03:00Z",
  "expected_revisions": [
    {
      "record_id": "SYS-RULE-0011",
      "revision_id": "SYS-RULE-0011.r2"
    }
  ],
  "format_version": "1",
  "grant_id": "GRANT-GLOBAL",
  "high_impact": true,
  "id": "TXN-000003",
  "idempotency_key": "synthetic-event-3",
  "instance_id": "alm.synthetic.example",
  "kind": "commit",
  "payload_sha256": "c74e6e34b8c1e8d196846dc9fa75b6574ff0fc71fcd970a549af3c7b74f08ec3",
  "principal_id": "principal:governor",
  "review_receipt_ids": [
    "REVIEW-0003"
  ],
  "scope_id": "GLOBAL",
  "sequence": 3,
  "source_refs": [],
  "writes": [
    "win://WIN-00003",
    "rev://SYS-RULE-0011.r3",
    "mem://SYS-RULE-0011"
  ]
}
