{
  "caused_by": [],
  "created_at": "2026-09-23T12:19:00Z",
  "expected_revisions": [],
  "format_version": "1",
  "grant_id": "GRANT-LIBRARY",
  "high_impact": false,
  "id": "TXN-000019",
  "idempotency_key": "synthetic-event-19",
  "instance_id": "alm.synthetic.example",
  "kind": "commit",
  "payload_sha256": "5724d337f709339cf96f71e9d389d6bd195189e9152160ff6b357e90b9e5bc22",
  "principal_id": "principal:library-owner",
  "review_receipt_ids": [],
  "scope_id": "PROJECT-LIBRARY",
  "sequence": 19,
  "source_refs": [],
  "writes": [
    "win://WIN-00020",
    "audit://AUDIT-0001",
    "proposal://SUG-REPAIR"
  ]
}
