{
  "caused_by": [],
  "created_at": "2026-09-23T12:18:00Z",
  "expected_revisions": [
    {
      "record_id": "SYS-RULE-0010",
      "revision_id": null
    }
  ],
  "format_version": "1",
  "grant_id": "GRANT-GLOBAL",
  "high_impact": false,
  "id": "TXN-000018",
  "idempotency_key": "synthetic-event-18",
  "instance_id": "alm.synthetic.example",
  "kind": "commit",
  "payload_sha256": "58b624307cefb73c42126d9f4777555ac4afb97fa8a22bd6df1d797aa76d2f19",
  "principal_id": "principal:governor",
  "review_receipt_ids": [],
  "scope_id": "GLOBAL",
  "sequence": 18,
  "source_refs": [],
  "writes": [
    "win://WIN-00018",
    "win://WIN-00019",
    "rev://SYS-RULE-0010.r1",
    "mem://SYS-RULE-0010",
    "candidate://CAND-CONFIRMED"
  ]
}
