{
  "caused_by": [],
  "created_at": "2026-09-23T12:11:00Z",
  "expected_revisions": [
    {
      "record_id": "LIB-FACT-0004",
      "revision_id": null
    }
  ],
  "format_version": "1",
  "grant_id": "GRANT-LIBRARY",
  "high_impact": false,
  "id": "TXN-000011",
  "idempotency_key": "synthetic-event-11",
  "instance_id": "alm.synthetic.example",
  "kind": "commit",
  "payload_sha256": "9caf06bd02b7dda519cfa2a5b8a772bfe70067ed1decde04d8dc397b05623681",
  "principal_id": "principal:library-owner",
  "review_receipt_ids": [],
  "scope_id": "PROJECT-LIBRARY",
  "sequence": 11,
  "source_refs": [],
  "writes": [
    "win://WIN-00011",
    "rev://LIB-FACT-0004.r1",
    "mem://LIB-FACT-0004",
    "conflict://CONF-0001"
  ]
}
