{
  "caused_by": [],
  "created_at": "2026-09-23T12:01:00Z",
  "expected_revisions": [
    {
      "record_id": "SYS-RULE-0011",
      "revision_id": null
    }
  ],
  "format_version": "1",
  "grant_id": "GRANT-GLOBAL",
  "high_impact": false,
  "id": "TXN-000001",
  "idempotency_key": "synthetic-event-1",
  "instance_id": "alm.synthetic.example",
  "kind": "commit",
  "payload_sha256": "4bd6d8696b94ea409ae5665c252733293524fe75760df96ed2c0f75175ecd9b9",
  "principal_id": "principal:governor",
  "review_receipt_ids": [],
  "scope_id": "GLOBAL",
  "sequence": 1,
  "source_refs": [],
  "writes": [
    "log://LOG-EXAMPLE",
    "win://WIN-00001",
    "rev://SYS-RULE-0011.r1",
    "mem://SYS-RULE-0011"
  ]
}
