{
  "caused_by": [],
  "created_at": "2026-09-23T12:05:00Z",
  "expected_revisions": [
    {
      "record_id": "LIB-DEC-0001",
      "revision_id": "LIB-DEC-0001.r1"
    }
  ],
  "format_version": "1",
  "grant_id": "GRANT-LIBRARY",
  "high_impact": true,
  "id": "TXN-000005",
  "idempotency_key": "synthetic-event-5",
  "instance_id": "alm.synthetic.example",
  "kind": "commit",
  "payload_sha256": "55ff048d8bf98dab87d14f40dc953e9ea0130ef7be623ff528f1e1805983292f",
  "principal_id": "principal:library-owner",
  "review_receipt_ids": [
    "REVIEW-0005"
  ],
  "scope_id": "PROJECT-LIBRARY",
  "sequence": 5,
  "source_refs": [],
  "writes": [
    "win://WIN-00005",
    "rev://LIB-DEC-0001.r2",
    "mem://LIB-DEC-0001"
  ]
}
