{
  "caused_by": [],
  "created_at": "2026-09-23T12:14:00Z",
  "expected_revisions": [],
  "format_version": "1",
  "grant_id": "GRANT-LIBRARY",
  "high_impact": false,
  "id": "TXN-000014",
  "idempotency_key": "synthetic-event-14",
  "instance_id": "alm.synthetic.example",
  "kind": "commit",
  "payload_sha256": "cd251543684c4763cfd7ec910c51328af3e814c5d213b52347f15540de1df119",
  "principal_id": "principal:library-owner",
  "review_receipt_ids": [],
  "scope_id": "PROJECT-LIBRARY",
  "sequence": 14,
  "source_refs": [],
  "writes": [
    "win://WIN-00014",
    "proposal://SUG-PROMOTION"
  ]
}
