{
  "caused_by": [
    "TXN-000014"
  ],
  "created_at": "2026-09-23T12:15:00Z",
  "expected_revisions": [
    {
      "record_id": "SYS-RULE-0020",
      "revision_id": null
    }
  ],
  "format_version": "1",
  "grant_id": "GRANT-GLOBAL",
  "high_impact": true,
  "id": "TXN-000015",
  "idempotency_key": "synthetic-event-15",
  "instance_id": "alm.synthetic.example",
  "kind": "commit",
  "payload_sha256": "525ee7cec42b2c70b49e3fb26ee6aa7d959e2d8cab85cc4f11f1994a2a9d75ce",
  "principal_id": "principal:governor",
  "review_receipt_ids": [
    "REVIEW-0015"
  ],
  "scope_id": "GLOBAL",
  "sequence": 15,
  "source_refs": [],
  "writes": [
    "win://WIN-00015",
    "rev://SYS-RULE-0020.r1",
    "mem://SYS-RULE-0020",
    "outbox://OUTBOX-PROMOTION"
  ]
}
