{
  "caused_by": [
    "TXN-000015"
  ],
  "created_at": "2026-09-23T12:16:00Z",
  "expected_revisions": [
    {
      "record_id": "LIB-RULE-0005",
      "revision_id": "LIB-RULE-0005.r2"
    }
  ],
  "format_version": "1",
  "grant_id": "GRANT-LIBRARY",
  "high_impact": true,
  "id": "TXN-000016",
  "idempotency_key": "synthetic-event-16",
  "instance_id": "alm.synthetic.example",
  "kind": "commit",
  "payload_sha256": "fd6e053bf4ed000e14a4a8a9c868e2e70546c99bdc969b090ed1b521be85be25",
  "principal_id": "principal:library-owner",
  "review_receipt_ids": [
    "REVIEW-0016"
  ],
  "scope_id": "PROJECT-LIBRARY",
  "sequence": 16,
  "source_refs": [],
  "writes": [
    "win://WIN-00016",
    "rev://LIB-RULE-0005.r3",
    "mem://LIB-RULE-0005"
  ]
}
