{
  "caused_by": [],
  "created_at": "2026-09-23T12:04:00Z",
  "expected_revisions": [
    {
      "record_id": "LIB-DEC-0001",
      "revision_id": null
    }
  ],
  "format_version": "1",
  "grant_id": "GRANT-LIBRARY",
  "high_impact": false,
  "id": "TXN-000004",
  "idempotency_key": "synthetic-event-4",
  "instance_id": "alm.synthetic.example",
  "kind": "commit",
  "payload_sha256": "b0fb82da18065e71a23b896bcbc81e89e0f41de921c0a1f09e55c0e668f49897",
  "principal_id": "principal:library-owner",
  "review_receipt_ids": [],
  "scope_id": "PROJECT-LIBRARY",
  "sequence": 4,
  "source_refs": [],
  "writes": [
    "win://WIN-00004",
    "rev://LIB-DEC-0001.r1",
    "mem://LIB-DEC-0001"
  ]
}
