{
  "caused_by": [
    "TXN-000007"
  ],
  "created_at": "2026-09-23T12:08:00Z",
  "expected_revisions": [
    {
      "record_id": "LIB-RULE-0005",
      "revision_id": "LIB-RULE-0005.r1"
    }
  ],
  "format_version": "1",
  "grant_id": "GRANT-LIBRARY",
  "high_impact": false,
  "id": "TXN-000008",
  "idempotency_key": "synthetic-event-8",
  "instance_id": "alm.synthetic.example",
  "kind": "commit",
  "payload_sha256": "8991328bba9bc3860529c7a226fa17a47a51df3188d1d821f0561431af3c4479",
  "principal_id": "principal:library-owner",
  "review_receipt_ids": [],
  "scope_id": "PROJECT-LIBRARY",
  "sequence": 8,
  "source_refs": [],
  "writes": [
    "win://WIN-00008",
    "rev://LIB-RULE-0005.r2",
    "mem://LIB-RULE-0005"
  ]
}
